{
  "$schema": "https://overkill-factory.dev/schemas/factory-master-plan-completion.schema.json",
  "record_type": "factory_master_plan_completion",
  "completion_version": "v3.0.0-master-plan-100",
  "source_plan_ref": "private-overkill-studies/20260629-021900-overkill-factory-master-plan/PLANO_MESTRE_OVERKILL_FACTORY.md",
  "waves": [
    {
      "wave": 0,
      "name": "Preparação e estabilização",
      "status": "implemented",
      "score": 100,
      "implementation_kinds": [
        "runtime_activation",
        "agent_activation",
        "operator_activation",
        "test_enforced"
      ],
      "evidence": {
        "code_refs": [
          "scripts/factory_master_update_plan_audit.py",
          "scripts/factory_master_plan_completion_audit.py",
          "scripts/factory_master_plan_literal_dod_audit.py",
          "scripts/factory_manager_intake_smoke.py",
          "scripts/factory_operator_progress_card.py",
          "scripts/factory_operator_delivery_receipt.py",
          "scripts/factory_product_face_result.py",
          "scripts/factory_learnback_proposal.py",
          "scripts/factory_telegram_start_smoke.py",
          "scripts/factory_manager_profile_live_smoke.py"
        ],
        "test_refs": [
          "tests/test_factory_master_update_plan.py",
          "tests/test_factory_master_plan_completion.py",
          "tests/test_factory_master_plan_literal_dod.py"
        ],
        "command_refs": [
          "command:python3 scripts/factory_master_update_plan_audit.py",
          "command:python3 scripts/factory_master_plan_completion_audit.py",
          "command:factoryctl literal-dod-audit",
          "command:factoryctl manager-intake-smoke",
          "command:factoryctl manager-profile-live-smoke --dry-run",
          "command:factoryctl operator-progress-card",
          "command:factoryctl operator-delivery-receipt",
          "command:factoryctl product-face-result",
          "command:factoryctl learnback-proposal",
          "command:factoryctl telegram-start-smoke --dry-run"
        ],
        "runtime_refs": [
          "templates/factory-master-update-plan.json",
          "templates/factory-master-plan-completion.json",
          "templates/factory-master-plan-literal-dod.json"
        ],
        "agent_refs": [
          "agents/worker-profiles.public.json",
          "agents/hermes-profile-bindings.public.json",
          "agents/worker-registry.public.json"
        ],
        "operator_refs": [
          "templates/operator-interface-profile.json",
          "templates/operator-delivery-receipt.json",
          "templates/operator-briefing-package.json",
          "docs/operations/telegram-operator-experience.md",
          "scripts/factory_operator_progress_card.py",
          "scripts/factory_operator_delivery_receipt.py",
          "scripts/render_human_gate_pdf.py"
        ],
        "evidence_refs": [
          "schemas/factory-master-update-plan.schema.json",
          "schemas/factory-master-plan-completion.schema.json",
          "docs/reference/factory-kernel-reference.md",
          "schemas/factory-master-plan-literal-dod.schema.json",
          "scripts/factory_master_plan_literal_dod_audit.py"
        ]
      }
    },
    {
      "wave": 1,
      "name": "Runtime Truth Spine",
      "status": "implemented",
      "score": 100,
      "implementation_kinds": [
        "runtime_activation",
        "agent_activation",
        "operator_activation",
        "test_enforced"
      ],
      "evidence": {
        "code_refs": [
          "scripts/factory_runtime_truth_spine_audit.py",
          "adapters/hermes/live_kanban_adapter.py",
          "scripts/factoryctl.py",
          "scripts/factory_hermes_live_smoke.py"
        ],
        "test_refs": [
          "tests/test_factory_runtime_truth_spine.py",
          "tests/test_hermes_live_kanban_adapter.py",
          "tests/test_factoryctl.py",
          "tests/test_hermes_adapter_v3_production_activation.py",
          "tests/test_factory_hermes_live_smoke.py"
        ],
        "command_refs": [
          "command:python3 scripts/factory_runtime_truth_spine_audit.py",
          "command:python3 scripts/factoryctl.py factory-perfect-run",
          "command:factoryctl hermes-live-smoke",
          "command:factoryctl v3-production-activation-check --live-hermes"
        ],
        "runtime_refs": [
          "templates/factory-runtime-truth-spine.json",
          "templates/factory-run.json",
          "templates/factory-run-event.json",
          "templates/factory-promotion-packet.json",
          "scripts/factory_hermes_live_smoke.py"
        ],
        "agent_refs": [
          "agents/worker-profiles.public.json",
          "agents/hermes-profile-bindings.public.json",
          "agents/worker-registry.public.json"
        ],
        "operator_refs": [
          "templates/operator-interface-profile.json",
          "templates/operator-delivery-receipt.json",
          "templates/operator-briefing-package.json",
          "docs/operations/telegram-operator-experience.md"
        ],
        "evidence_refs": [
          "schemas/factory-runtime-truth-spine.schema.json",
          "templates/ready-work-unit-hermes-materialization-plan.json",
          "scripts/factory_hermes_live_smoke.py"
        ]
      }
    },
    {
      "wave": 2,
      "name": "Autonomy and No-Idle Engine",
      "status": "implemented",
      "score": 100,
      "implementation_kinds": [
        "runtime_activation",
        "agent_activation",
        "operator_activation",
        "test_enforced"
      ],
      "evidence": {
        "code_refs": [
          "scripts/factory_canonical_frontier_audit.py",
          "adapters/hermes/live_kanban_adapter.py",
          "scripts/factoryctl.py",
          "scripts/factory_hermes_live_smoke.py"
        ],
        "test_refs": [
          "tests/test_factory_canonical_frontier.py",
          "tests/test_factory_no_idle_watchdog.py",
          "tests/test_factory_board_reconciler.py",
          "tests/test_hermes_adapter_v3_production_activation.py",
          "tests/test_factory_hermes_live_smoke.py"
        ],
        "command_refs": [
          "command:python3 scripts/factory_canonical_frontier_audit.py",
          "command:python3 scripts/factoryctl.py reconcile-board --help",
          "command:factoryctl hermes-live-smoke",
          "command:factoryctl v3-production-activation-check --live-hermes"
        ],
        "runtime_refs": [
          "templates/factory-canonical-frontier-policy.json",
          "templates/factory-status-snapshot.json",
          "templates/factory-decision-outbox.json",
          "scripts/factory_hermes_live_smoke.py"
        ],
        "agent_refs": [
          "agents/worker-profiles.public.json",
          "agents/hermes-profile-bindings.public.json",
          "agents/worker-registry.public.json"
        ],
        "operator_refs": [
          "templates/operator-interface-profile.json",
          "templates/operator-delivery-receipt.json",
          "templates/operator-briefing-package.json",
          "docs/operations/telegram-operator-experience.md"
        ],
        "evidence_refs": [
          "schemas/factory-canonical-frontier-policy.schema.json",
          "schemas/factory-status-snapshot.schema.json",
          "scripts/factory_hermes_live_smoke.py"
        ]
      }
    },
    {
      "wave": 3,
      "name": "Manager-Only Operator Experience OS",
      "status": "implemented",
      "score": 100,
      "implementation_kinds": [
        "runtime_activation",
        "agent_activation",
        "operator_activation",
        "test_enforced"
      ],
      "evidence": {
        "code_refs": [
          "scripts/factory_manager_agent_freshness_audit.py",
          "scripts/factoryctl.py",
          "scripts/factory_hermes_live_smoke.py"
        ],
        "test_refs": [
          "tests/test_factory_manager_agent_freshness.py",
          "tests/test_operator_experience.py",
          "tests/test_factory_master_plan_completion.py",
          "tests/test_factory_hermes_live_smoke.py"
        ],
        "command_refs": [
          "command:python3 scripts/factory_manager_agent_freshness_audit.py",
          "command:python3 scripts/factoryctl.py v3-production-activation-check",
          "command:factoryctl hermes-live-smoke",
          "command:factoryctl v3-production-activation-check --live-hermes"
        ],
        "runtime_refs": [
          "templates/factory-manager-agent-freshness-policy.json",
          "templates/operator-interface-profile.json",
          "scripts/factory_hermes_live_smoke.py"
        ],
        "agent_refs": [
          "agents/worker-profiles.public.json",
          "agents/hermes-profile-bindings.public.json",
          "agents/worker-registry.public.json"
        ],
        "operator_refs": [
          "templates/operator-interface-profile.json",
          "templates/operator-delivery-receipt.json",
          "templates/operator-briefing-package.json",
          "docs/operations/telegram-operator-experience.md"
        ],
        "evidence_refs": [
          "schemas/factory-manager-agent-freshness-policy.schema.json",
          "docs/agents/live-agent-configuration.md",
          "scripts/factory_hermes_live_smoke.py"
        ]
      }
    },
    {
      "wave": 4,
      "name": "Human Gate Package, PDF e vídeo",
      "status": "implemented",
      "score": 100,
      "implementation_kinds": [
        "runtime_activation",
        "agent_activation",
        "operator_activation",
        "test_enforced"
      ],
      "evidence": {
        "code_refs": [
          "scripts/render_human_gate_pdf.py",
          "scripts/factoryctl.py"
        ],
        "test_refs": [
          "tests/test_factory_master_plan_completion.py",
          "tests/test_operator_experience.py"
        ],
        "command_refs": [
          "command:python3 scripts/render_human_gate_pdf.py",